repo_name,key_topics,key_goals,key_use_cases
socketify.py,"WebSockets, ASGI, WSGI, Python, Networking, HTTP/HTTPS, Web Frameworks, TLS 1.3, Pub/Sub","To provide a fast, reliable, and feature-rich Python web framework that supports modern networking protocols like WebSockets, HTTP/HTTPS, and integrates seamlessly with ASGI/WSGI standards.","Building real-time, bidirectional communication applications using WebSockets.; Developing high-performance web APIs and backend services (HTTP/HTTPS).; Creating scalable web applications that require middleware, templating (Jinja2, Mako), and dynamic routing.; Implementing secure web services using TLS 1.3 and SSL certificates."
stitch-mcp,"CLI Development, AI Design Workflow, Google Cloud Platform (GCP), Stitch Platform, Full-Stack Development, Coding Agents/AI Integration, Vite, Astro","The project provides a command-line interface (CLI) to bridge the gap between AI-generated UI designs (from Stitch) and a functional development environment. It allows developers to locally preview, build, and integrate these designs into coding agents and development workflows.","Previewing AI-generated UI designs locally on a development server.; Generating a complete, deployable website (e.g., an Astro site) directly from design screens.; Providing structured design context and tools to AI coding agents (e.g., VS Code, Gemini) for automated development.; Interactively browsing and inspecting design data (projects, screens, metadata) directly within the terminal."
TextRecogn,"Machine Learning, AIGC Text Recognition, Docker, Python, NLP (Natural Language Processing)","The project aims to recognize and uncover text generated by AI/AIGC sources, providing an online tool and a local deployment method for text extraction.","Analyzing documents suspected of containing AI-generated text.; Developing a local, private environment for running text recognition models.; Testing the accuracy of text recognition models (e.g., using `check.py` with `docx` files)."
VoiceInk,"Voice-to-Text Transcription, macOS Development, Local AI/Machine Learning, Natural Language Processing (NLP), DevOps/System Integration","To provide the most efficient, privacy-focused, and context-aware voice-to-text solution for macOS, ensuring all processing happens locally on the device.",Transcribing spoken notes or meetings into text on macOS.; Creating a hands-free dictation tool for writing documents or emails.; Using a conversational AI assistant for quick chat interactions (like a ChatGPT replacement).; Capturing dictated content while maintaining strict data privacy (offline processing).
worldmonitor,"Geopolitical Intelligence, Real-time Data Aggregation, AI/Machine Learning, Web Development (TypeScript, Vite), 3D Mapping (globe.gl, deck.gl), Desktop Development (Tauri, Rust), Financial Data Analysis","To provide a unified, real-time global intelligence dashboard that aggregates and synthesizes diverse data streams—including news, geopolitical events, financial markets, and infrastructure—into actionable, situational awareness insights.","Monitoring global geopolitical risks and conflicts.; Tracking real-time financial market movements (stocks, commodities, crypto).; Analyzing disaster or crisis situations using multi-source correlation.; Developing a comprehensive situational awareness interface for intelligence or risk management.; Building cross-domain dashboards (e.g., tech, finance, commodity-specific views)."
